{
  "case_id": "CASE-000001",
  "report_filename": "report-a.pdf",
  "matched_report_path": "/Users/xiamin/.codex/.chatgpt-projects/g-p-6a8704863f9481918a817037d9468f7e/p0_integration/KNOWLEDGE_QUALITY_ISSUE_ANALYSIS_ENGINE_V1.1_QUALITY_CAPABILITY_P0_RC1/tests/samples/reports/report-a.pdf",
  "candidate_paths": [
    "/Users/xiamin/.codex/.chatgpt-projects/g-p-6a8704863f9481918a817037d9468f7e/p0_integration/KNOWLEDGE_QUALITY_ISSUE_ANALYSIS_ENGINE_V1.1_QUALITY_CAPABILITY_P0_RC1/tests/samples/reports/report-a.pdf"
  ],
  "match_type": "EXACT_FILENAME",
  "file_hash": "f82269b06dafc339d0d175e3e3a6602aa7fc2a75f77e3201076eb8f6b2763685",
  "file_size": 17,
  "parse_status": "NOT_PARSED",
  "sections": [],
  "unclassified_blocks": [],
  "parse_warnings": [],
  "generated_at": "2026-08-24T05:27:32.517350+00:00"
}