{
  "case_id": "CASE-000004",
  "report_filename": "dup.pdf",
  "matched_report_path": "",
  "candidate_paths": [
    "/Users/xiamin/.codex/.chatgpt-projects/g-p-6a8704863f9481918a817037d9468f7e/p0_integration/KNOWLEDGE_QUALITY_ISSUE_ANALYSIS_ENGINE_V1.1_QUALITY_CAPABILITY_P0_RC1/tests/samples/reports/dup.pdf",
    "/Users/xiamin/.codex/.chatgpt-projects/g-p-6a8704863f9481918a817037d9468f7e/p0_integration/KNOWLEDGE_QUALITY_ISSUE_ANALYSIS_ENGINE_V1.1_QUALITY_CAPABILITY_P0_RC1/tests/samples/reports/nested/dup.pdf"
  ],
  "match_type": "AMBIGUOUS",
  "file_hash": "",
  "file_size": 0,
  "parse_status": "AMBIGUOUS",
  "sections": [],
  "unclassified_blocks": [],
  "parse_warnings": [
    "MULTIPLE_REPORT_MATCHES"
  ],
  "generated_at": "2026-08-24T05:27:32.518284+00:00"
}