{
  "case_id": "CASE-000003",
  "report_filename": "missing.pdf",
  "matched_report_path": "",
  "candidate_paths": [],
  "match_type": "NOT_FOUND",
  "file_hash": "",
  "file_size": 0,
  "parse_status": "REPORT_NOT_FOUND",
  "sections": [],
  "unclassified_blocks": [],
  "parse_warnings": [
    "REPORT_NOT_FOUND"
  ],
  "generated_at": "2026-08-24T05:27:32.518001+00:00"
}