{
  "case_id": "CASE-000002",
  "report_filename": "",
  "matched_report_path": "",
  "candidate_paths": [],
  "match_type": "NO_REPORT_NAME",
  "file_hash": "",
  "file_size": 0,
  "parse_status": "NO_REPORT",
  "sections": [],
  "unclassified_blocks": [],
  "parse_warnings": [
    "REPORT_FILENAME_EMPTY"
  ],
  "generated_at": "2026-08-24T05:27:32.517692+00:00"
}