{
  "case_id": "CASE-000005",
  "report_filename": "report-e.pdf",
  "matched_report_path": "/Users/xiamin/.codex/.chatgpt-projects/g-p-6a8704863f9481918a817037d9468f7e/p0_integration/KNOWLEDGE_QUALITY_ISSUE_ANALYSIS_ENGINE_V1.1_QUALITY_CAPABILITY_P0_RC1/tests/samples/reports/report-e.pdf",
  "candidate_paths": [
    "/Users/xiamin/.codex/.chatgpt-projects/g-p-6a8704863f9481918a817037d9468f7e/p0_integration/KNOWLEDGE_QUALITY_ISSUE_ANALYSIS_ENGINE_V1.1_QUALITY_CAPABILITY_P0_RC1/tests/samples/reports/report-e.pdf"
  ],
  "match_type": "EXACT_FILENAME",
  "file_hash": "319c80e7e14b6da28c919ed21d9297f6429bc5e682c7c51423e7225c12d05587",
  "file_size": 17,
  "parse_status": "NOT_PARSED",
  "sections": [],
  "unclassified_blocks": [],
  "parse_warnings": [],
  "generated_at": "2026-08-24T05:27:32.518663+00:00"
}